{
  "schema_version": 1,
  "logos_version": "0.1.0",
  "generated_at": "2026-07-16T08:27:49.488563+00:00",
  "selection_policy": {
    "default_status": "active",
    "raw_assets_selected": false,
    "target": "gemini-cli",
    "profile": "gemini"
  },
  "total_assets": 83,
  "selected_assets": 11,
  "validation_issue_count": 0,
  "assets": [
    {
      "id": "logos.core.context.compression",
      "path": "context/compression.md",
      "kind": "context",
      "status": "raw",
      "selected": false,
      "has_frontmatter": false,
      "version": null,
      "sha256": "58dbbc38856d28105586341a17dd4da039aa85c1955bd0ceec9529f1f4ba44bb"
    },
    {
      "id": "logos.core.context.discovery",
      "path": "context/discovery.md",
      "kind": "context",
      "status": "raw",
      "selected": false,
      "has_frontmatter": false,
      "version": null,
      "sha256": "3ce6263451bb63438b6234fa2ecdc945552b0fc9ccea4c425021bff596c4542f"
    },
    {
      "id": "logos.core.context.evidence",
      "path": "context/evidence.md",
      "kind": "context",
      "status": "raw",
      "selected": false,
      "has_frontmatter": false,
      "version": null,
      "sha256": "5b1ebeff8e93d33064933636af9f46d9d12254eb37d33224cd45dd2b15af1b9c"
    },
    {
      "id": "logos.core.context.handoff",
      "path": "context/handoff.md",
      "kind": "context",
      "status": "raw",
      "selected": false,
      "has_frontmatter": false,
      "version": null,
      "sha256": "df70d6e051ee4cf627af8e604b43239301a8036c058f2a36ca148ceeb40c59ef"
    },
    {
      "id": "logos.core.context.session-memory",
      "path": "context/session-memory.md",
      "kind": "context",
      "status": "raw",
      "selected": false,
      "has_frontmatter": false,
      "version": null,
      "sha256": "ddd0206afeedcb37df210fb4cdc820e12bdd309a1ef55f6190c01990c4cbc4b4"
    },
    {
      "id": "logos.core.evaluation.acceptance-criteria",
      "path": "evaluation/acceptance-criteria.md",
      "kind": "rubric",
      "status": "raw",
      "selected": false,
      "has_frontmatter": false,
      "version": null,
      "sha256": "0bc1cb85eb809a6d09791702f284ebc86671bc5f256fa08e2968ca07e10363df"
    },
    {
      "id": "logos.core.evaluation.final-response-rubric",
      "path": "evaluation/final-response-rubric.md",
      "kind": "rubric",
      "status": "raw",
      "selected": false,
      "has_frontmatter": false,
      "version": null,
      "sha256": "40bee780b1d889304c30bcb0c36f8b2dfacd66c21d8352c6f8702f4f0b37cb19"
    },
    {
      "id": "logos.core.evaluation.implementation-rubric",
      "path": "evaluation/implementation-rubric.md",
      "kind": "rubric",
      "status": "raw",
      "selected": false,
      "has_frontmatter": false,
      "version": null,
      "sha256": "156fce0801a5cf213ee37d1ac0cb8f62babc9a296524a33d3b518687cd7f90c9"
    },
    {
      "id": "logos.core.evaluation.plan-rubric",
      "path": "evaluation/plan-rubric.md",
      "kind": "rubric",
      "status": "raw",
      "selected": false,
      "has_frontmatter": false,
      "version": null,
      "sha256": "96269bb08e9984cd6495c0c4b2188c5141e5a1fa0c4e2b4af91c8df3593ec627"
    },
    {
      "id": "logos.core.evaluation.review-rubric",
      "path": "evaluation/review-rubric.md",
      "kind": "rubric",
      "status": "raw",
      "selected": false,
      "has_frontmatter": false,
      "version": null,
      "sha256": "49ab7090ebf66287c21811822810232e25bec183614891dc12e5c9440af4dcac"
    },
    {
      "id": "logos.core.evaluation.test-rubric",
      "path": "evaluation/test-rubric.md",
      "kind": "rubric",
      "status": "raw",
      "selected": false,
      "has_frontmatter": false,
      "version": null,
      "sha256": "25ebde0314f0048ef27920027f1cde9ec92d728f88aa2e1b5f8a237e21bdd9e7"
    },
    {
      "id": "logos.core.guards.context-budget",
      "path": "guards/context-budget.yaml",
      "kind": "guard",
      "status": "raw",
      "selected": false,
      "has_frontmatter": false,
      "version": null,
      "sha256": "6439ef3155c6bd5aa64bd91cb5a3486851628b41973d1a6c1734cce36f80512c"
    },
    {
      "id": "logos.core.guards.dependency-install",
      "path": "guards/dependency-install.yaml",
      "kind": "guard",
      "status": "raw",
      "selected": false,
      "has_frontmatter": false,
      "version": null,
      "sha256": "0d831f1262ffdabb09e6223c3eb6013911d32034926178fbdabcb1edcbc663b2"
    },
    {
      "id": "logos.core.guards.destructive-command",
      "path": "guards/destructive-command.yaml",
      "kind": "guard",
      "status": "raw",
      "selected": false,
      "has_frontmatter": false,
      "version": null,
      "sha256": "2b7aa2236d7ddb7af7194fd969609d99cfa54c8c51cd9313de899aeedf109d0b"
    },
    {
      "id": "logos.core.guards.excluded-scope",
      "path": "guards/excluded-scope.yaml",
      "kind": "guard",
      "status": "raw",
      "selected": false,
      "has_frontmatter": false,
      "version": null,
      "sha256": "1bed1a997cb957c341f1ee5d4b6111883dbb94bb201ed8a0e492d32899a5ab1a"
    },
    {
      "id": "logos.core.guards.file-write-boundary",
      "path": "guards/file-write-boundary.yaml",
      "kind": "guard",
      "status": "raw",
      "selected": false,
      "has_frontmatter": false,
      "version": null,
      "sha256": "4a35e95503bd7e0b89682a7f1d5f9e37b09662da1bb8cc5595c63d617c754e95"
    },
    {
      "id": "logos.core.guards.high-risk-override",
      "path": "guards/high-risk-override.yaml",
      "kind": "guard",
      "status": "raw",
      "selected": false,
      "has_frontmatter": false,
      "version": null,
      "sha256": "49b7c4101d4a3bc060ff9c68bce7226901834a37ae4ee61eb18e76da340dc2c2"
    },
    {
      "id": "logos.core.guards.required-fields",
      "path": "guards/required-fields.yaml",
      "kind": "guard",
      "status": "raw",
      "selected": false,
      "has_frontmatter": false,
      "version": null,
      "sha256": "bb7532ea3b8e9b4ddd6e6bcf7213865f8da2579bbd3fc3ccac9e60304807e6c3"
    },
    {
      "id": "logos.core.guards.secrets-detection",
      "path": "guards/secrets-detection.yaml",
      "kind": "guard",
      "status": "raw",
      "selected": false,
      "has_frontmatter": false,
      "version": null,
      "sha256": "e6b649939d1924a165d1423e58f75d615a16aded94348b15b1502accfed9d5b2"
    },
    {
      "id": "logos.core.profiles.codex",
      "path": "profiles/codex.yaml",
      "kind": "profile",
      "status": "raw",
      "selected": false,
      "has_frontmatter": false,
      "version": null,
      "sha256": "63cd6cac68d2f8b9269eb1a9330b0aaa8b132441caf3bb3c8ff6deaec0cc6b13"
    },
    {
      "id": "logos.core.profiles.gemini",
      "path": "profiles/gemini.yaml",
      "kind": "profile",
      "status": "raw",
      "selected": false,
      "has_frontmatter": false,
      "version": null,
      "sha256": "cbf0685d2aa0e0498d31f680f2c633e4398f75f02d73cf223bc9c90b71cf1cf7"
    },
    {
      "id": "logos.core.prompts.assembly",
      "path": "prompts/assembly.md",
      "kind": "prompt",
      "status": "raw",
      "selected": false,
      "has_frontmatter": false,
      "version": null,
      "sha256": "60bd446c1f5b9602cf4a687e607f8e84e0411a28daf00a8dfb33a43ee0e4b17f"
    },
    {
      "id": "logos.template.base-system",
      "path": "prompts/base-system.md",
      "kind": "template",
      "status": "active",
      "selected": true,
      "has_frontmatter": true,
      "version": "0.1.0",
      "sha256": "8bfce3a11fcdf9c6ebf3ec62a51983d5aafa7f463d79d55ae0d544b9c8213937"
    },
    {
      "id": "logos.core.prompts.README",
      "path": "prompts/README.md",
      "kind": "prompt",
      "status": "raw",
      "selected": false,
      "has_frontmatter": false,
      "version": null,
      "sha256": "b3af00244b4a4791cc91f647717e7a8c85c75cd094c337b3bf262baca93b02a3"
    },
    {
      "id": "logos.template.response-style",
      "path": "prompts/response-style.md",
      "kind": "template",
      "status": "active",
      "selected": true,
      "has_frontmatter": true,
      "version": "0.1.0",
      "sha256": "6ba2dc3fb282ad7afde0bfc0a7b11930edc3a409cee06ad63182dabd415be1ad"
    },
    {
      "id": "logos.template.target-adapter",
      "path": "prompts/target-adapter.md",
      "kind": "template",
      "status": "active",
      "selected": true,
      "has_frontmatter": true,
      "version": "0.1.0",
      "sha256": "6d589c6b0397f75731ffd5fa6369a7f3a304cf6243b521a05e7dd4b827ac4ff6"
    },
    {
      "id": "logos.core.README",
      "path": "README.md",
      "kind": "asset",
      "status": "raw",
      "selected": false,
      "has_frontmatter": false,
      "version": null,
      "sha256": "44e0981dee57b5f2ae97e5bc94149703451cafc991fd0f706ff1fcc6972bc6e4"
    },
    {
      "id": "logos.core.roles.executor.contract",
      "path": "roles/executor/contract.md",
      "kind": "role",
      "status": "raw",
      "selected": false,
      "has_frontmatter": false,
      "version": null,
      "sha256": "f661d97d1b98b79cdb126e27f4c49749439d356fba4ae2ff8655aed28df2c801"
    },
    {
      "id": "logos.core.roles.executor.edit-policy",
      "path": "roles/executor/edit-policy.md",
      "kind": "role",
      "status": "raw",
      "selected": false,
      "has_frontmatter": false,
      "version": null,
      "sha256": "54812a861ea10ef2a4c1f4717e19e7661543e9489a089c287e6283ea0edbfa6a"
    },
    {
      "id": "logos.core.roles.executor.failure-modes",
      "path": "roles/executor/failure-modes.md",
      "kind": "role",
      "status": "raw",
      "selected": false,
      "has_frontmatter": false,
      "version": null,
      "sha256": "698944f0093b10ced76ee38792fb3156df2f7a2aa4173fcef9a959bd3c7ce890"
    },
    {
      "id": "logos.core.roles.executor.outputs",
      "path": "roles/executor/outputs.md",
      "kind": "role",
      "status": "raw",
      "selected": false,
      "has_frontmatter": false,